{
  "listID": "LIST-chores-7383",
  "name": "chores",
  "createdAt": "2024-03-24T17:37:47.409Z",
  "tasks": [
    {
      "id": "TASK-Swee-a4da",
      "updatedAt": "2024-03-24T18:29:46.935Z",
      "status": "incomplete",
      "color": "red",
      "task": "Mop the kitchen"
    }
  ],
  "completedTasks": []
}